{"agent_profile_version":"video_intake_agent_v1.0.0","agent_runtime_version":"synthetic-runtime-1","attempt_no":1,"bootstrap_refs":[{"description":"stage-three public implementation seal","object_id":"8c64bc910168e4212f081cdcc0ac2099738dcd3a","ref_type":"git_commit"},{"description":"stage-three public tree","object_id":"bcd5ef0545d7796fa8af15ecf29186f118742e9e","ref_type":"git_tree"},{"content_hash":"47bba36d142f2ad1e7f406015d2117f8d720b971607016d3db21a44b7f02ded8","content_hash_algorithm":"sha256","purpose":"bounded synthetic code and input surface","ref_type":"working_tree_manifest","relative_path":"examples/execution_contract/synthetic_run/working_tree_manifest.json"},{"content_hash":"e14161e9824f479d806ec7de935b4683af9a3c7147ac2e9f13336254d3c7b740","content_hash_algorithm":"sha256","purpose":"fixed synthetic DAG declaration","ref_type":"dag_config","relative_path":"examples/execution_contract/synthetic_run/youtube_truthfulness_dag_v1_1.yaml"}],"code_ref":{"git_commit":"8c64bc910168e4212f081cdcc0ac2099738dcd3a","working_tree_dirty":true,"working_tree_manifest_hash":"47bba36d142f2ad1e7f406015d2117f8d720b971607016d3db21a44b7f02ded8","working_tree_manifest_path":"examples/execution_contract/synthetic_run/working_tree_manifest.json"},"created_at":"2026-01-01T00:00:00Z","dag_node_id":"source_identity","dag_version":"youtube_truthfulness_dag_v1.1.0","declared_read_set":[{"artifact_id":"artifact_01j00000000000000000000001","purpose":"read synthetic input Artifact","scope_type":"artifact"},{"purpose":"read synthetic input bytes","relative_path":"examples/execution_contract/synthetic_run/artifacts/input.json","scope_type":"path"},{"purpose":"validate synthetic Registry","relative_path":"examples/execution_contract/synthetic_run/artifact_registry.jsonl","scope_type":"path"},{"purpose":"validate bounded code reference","relative_path":"examples/execution_contract/synthetic_run/working_tree_manifest.json","scope_type":"path"},{"purpose":"validate DAG version and topology","relative_path":"examples/execution_contract/synthetic_run/youtube_truthfulness_dag_v1_1.yaml","scope_type":"path"}],"declared_write_set":[{"purpose":"write only the bounded public synthetic bundle","recursive":true,"relative_path":"examples/execution_contract/synthetic_run","scope_type":"path_prefix"}],"environment_ref":{"architecture":"x86_64","dependency_manifest_hash":null,"dependency_manifest_path":null,"os_family":"windows","runtime_name":"python","runtime_version":"3.13"},"human_gate_policy":{"approval_required":false,"decision_artifact_required":false,"gate_node_ids":[],"implicit_approval_allowed":false},"manifest_hash":"9f7a24e095f6ad72025556b18a4cd5aae78239bec47df2b54bbfd64fc879395e","parent_checkpoint_id":null,"project_version":"v0.2","prompt_version":"s01_prompt_v1.0.0","release_id":"truthfulness_v0.2_youtube_video","run_id":"run_01j00000000000000000000000","schema_versions":["artifact_record_v1.1.0","current_state_v1.0.0","execution_checkpoint_v1.0.0","execution_event_v1.0.0","handoff_v2.0.0","session_manifest_v1.0.0"],"session_id":"session_01j00000000000000000000000","session_manifest_version":"session_manifest_v1.0.0","stage_id":"S01","storage_version":"V02","task_id":"task_01j00000000000000000000000","task_scope":"run","workflow_version":"youtube_truthfulness_workflow_v1.1.0"}
